{
  "schemaVersion": 1,
  "kind": "completed-import",
  "applicationImported": true,
  "preparedAt": "2026-08-24T00:00:00.000Z",
  "reviewedBy": "conductor-authorized automated provenance contract",
  "source": {
    "repository": "https://github.com/dmustapha/triage-0",
    "localObjectStore": "/Users/MAC/triage-0",
    "commit": "74424721bc75f564808eacce42d7f7f42676ae0f",
    "license": "Apache-2.0"
  },
  "scope": {
    "included": [
      "English text workflow",
      "local RAG",
      "deterministic clinical controls",
      "localhost UI/assets",
      "required tests and quality records",
      "package, ingestion, and SDK patch inputs"
    ],
    "excluded": [
      "speech-to-text",
      "text-to-speech",
      "translation",
      "cloud deployment",
      "demo/screenshots",
      "mutable performance logs",
      "model weights"
    ]
  },
  "notices": {
    "apache20": "Reused Triage-0 material remains subject to the Apache License, Version 2.0; retain its copyright, license, and NOTICE obligations.",
    "priorHackathon": "Triage-0 previously appeared as a non-commercial proof of concept in the June 2026 QVAC hackathon."
  },
  "reviews": {
    "sourceRights": {
      "completed": false,
      "required": true
    },
    "clinical": {
      "completed": false,
      "required": true
    }
  },
  "imports": [
    {
      "sourcePath": "LICENSE",
      "destinationPath": "docs/licenses/TRIAGE-0-APACHE-2.0.txt",
      "sourceGitObject": "d645695673349e3947e8e5ae42332d0ac3164cd7",
      "sourceSha256": "cfc7749b96f63bd31c3c42b5c471bf756814053e847c10f3eb003417bc523d30",
      "originalCreatedAt": "2026-06-20T22:46:36+01:00",
      "classification": "reused",
      "purpose": "Exact pinned baseline component",
      "destinationStatus": "present",
      "destinationSha256": "cfc7749b96f63bd31c3c42b5c471bf756814053e847c10f3eb003417bc523d30"
    },
    {
      "sourcePath": "data/protocols/README.md",
      "destinationPath": "data/protocols/README.md",
      "sourceGitObject": "9b2c1ee0992b89e7950f963a7ff803542bf68562",
      "sourceSha256": "3015554641ab746342cb2bcc9c08aa1f59909e01c11412c37399b4d8c3a55a42",
      "originalCreatedAt": "2026-06-20T22:46:36+01:00",
      "classification": "modified-for-adtc",
      "purpose": "Pinned baseline requiring the documented ADTC scope/runtime adaptation",
      "destinationStatus": "present",
      "destinationSha256": "846c7553e0ba3516d48299ccb3c688010304bdd5b21a5219d87dd67825445c36",
      "modification": {
        "status": "modified",
        "reason": "Replaced manual-only WHO setup with the checksum-locked, idempotent protocol downloader used by clean local setup."
      }
    },
    {
      "sourcePath": "data/rag/dose-tables.txt",
      "destinationPath": "data/rag/dose-tables.txt",
      "sourceGitObject": "059d4a8bc711debbc1675c27eb7c9ea1b474f0f3",
      "sourceSha256": "6a2d590e7ec2e2be1eea55633396c00d71c3032f2ead83f05b295cd77978c8fd",
      "originalCreatedAt": "2026-06-21T21:06:46+01:00",
      "classification": "reused",
      "purpose": "Exact pinned baseline component",
      "destinationStatus": "present",
      "destinationSha256": "6a2d590e7ec2e2be1eea55633396c00d71c3032f2ead83f05b295cd77978c8fd"
    },
    {
      "sourcePath": "package-lock.json",
      "destinationPath": "package-lock.json",
      "sourceGitObject": "1657f86c50981da3979506fdd39e5404ab8135b9",
      "sourceSha256": "211a7da1ddddba9dd82d8aa667054254103ae52d24b9e2ada9aea7b4aefb00e0",
      "originalCreatedAt": "2026-06-20T22:46:36+01:00",
      "classification": "modified-for-adtc",
      "purpose": "Pinned baseline requiring the documented ADTC scope/runtime adaptation",
      "destinationStatus": "present",
      "destinationSha256": "fe8d897e054ad113d73aa980e254f64cd0cf15992ade583ad7f3a2033eb72630",
      "modification": {
        "status": "modified",
        "reason": "Reconciled one lockfile for the merged ADTC evidence and Triage-0 application dependency contract."
      }
    },
    {
      "sourcePath": "package.json",
      "destinationPath": "package.json",
      "sourceGitObject": "23a463a610a104a5958dbd942b892b4dbf2c1197",
      "sourceSha256": "7e17c62f9a57f6fd450bac3b67ddf3990b7cdefc550f1a1a46a0818e10ca96c9",
      "originalCreatedAt": "2026-06-20T22:46:36+01:00",
      "classification": "modified-for-adtc",
      "purpose": "Pinned baseline requiring the documented ADTC scope/runtime adaptation",
      "destinationStatus": "present",
      "destinationSha256": "c66d55823ec7aaeed6f574129100dacbf315df5845230ee9b4ba8e87670837bd",
      "modification": {
        "status": "modified",
        "reason": "Preserved ADTC evidence commands while adding the pinned Triage-0 runtime, application, and corrected integration-test package contract."
      }
    },
    {
      "sourcePath": "public/app.html",
      "destinationPath": "public/app.html",
      "sourceGitObject": "deab61457f09dc3d785dbe68f97dc6667fd2e8b1",
      "sourceSha256": "9e9e07262d0d39ea9750af7ef36bd7a380d69740b034d75cf8873042b48c9ecc",
      "originalCreatedAt": "2026-06-20T22:46:36+01:00",
      "classification": "modified-for-adtc",
      "purpose": "Pinned baseline requiring the documented ADTC scope/runtime adaptation",
      "destinationStatus": "present",
      "destinationSha256": "475028a51b9c4f5a97d034e265f7f4947f5f2f99732ce590d19040eca1c2904c",
      "modification": {
        "status": "modified",
        "reason": "Restored one unified textarea, one Get guidance action, and one shared result region; removed visible assessment and model modes plus submitted-prompt shortcuts; preserved manual paste of the exact two Gate 1 prompts."
      }
    },
    {
      "sourcePath": "public/apple-touch-icon.png",
      "destinationPath": "public/apple-touch-icon.png",
      "sourceGitObject": "a3d27c3819f630aea4ebc360ea3824cb58614557",
      "sourceSha256": "24363e10e923032009519d545ba1fc70d11e91e5f6913588996395e4dfbb7255",
      "originalCreatedAt": "2026-06-23T12:18:25+01:00",
      "classification": "reused",
      "purpose": "Exact pinned baseline component",
      "destinationStatus": "present",
      "destinationSha256": "24363e10e923032009519d545ba1fc70d11e91e5f6913588996395e4dfbb7255"
    },
    {
      "sourcePath": "public/assets/css/app.css",
      "destinationPath": "public/assets/css/app.css",
      "sourceGitObject": "19c00b7ef3837c8e0f833167b4aff44469bdf786",
      "sourceSha256": "6d6fa0ef915a636065b10f7f560211c1158978815f9cb445ac7dfe6b7ee76fa8",
      "originalCreatedAt": "2026-06-20T22:46:36+01:00",
      "classification": "modified-for-adtc",
      "purpose": "Pinned baseline requiring the documented ADTC scope/runtime adaptation",
      "destinationStatus": "present",
      "destinationSha256": "1e0ef271494d3f64ef453733c5de70db5f1c0d00c39af5170de2746ccf1a1cfa",
      "modification": {
        "status": "modified",
        "reason": "Removed obsolete public classification, plan, and raw-retrieval-excerpt styling; added result-first respiratory assessment, input-authority, and provenance styles; and raised mobile controls and operational text to comfortable touch targets."
      }
    },
    {
      "sourcePath": "public/assets/css/base.css",
      "destinationPath": "public/assets/css/base.css",
      "sourceGitObject": "45ea96190273a667fa5b7385236a07a1605ea391",
      "sourceSha256": "c4622777ee144687d57644e1fc76bba386ef37e417646973a34c4c1f776e35ec",
      "originalCreatedAt": "2026-06-20T22:46:36+01:00",
      "classification": "reused",
      "purpose": "Exact pinned baseline component",
      "destinationStatus": "present",
      "destinationSha256": "c4622777ee144687d57644e1fc76bba386ef37e417646973a34c4c1f776e35ec"
    },
    {
      "sourcePath": "public/assets/css/fonts.css",
      "destinationPath": "public/assets/css/fonts.css",
      "sourceGitObject": "1fca882d4747a2eda8b54f88911d49b933c76679",
      "sourceSha256": "8abff9c97d4997a6d0e9a9c9f7401cdf22c01ce6f7e00fc05e0cb7d96554dc85",
      "originalCreatedAt": "2026-06-20T22:46:36+01:00",
      "classification": "reused",
      "purpose": "Exact pinned baseline component",
      "destinationStatus": "present",
      "destinationSha256": "8abff9c97d4997a6d0e9a9c9f7401cdf22c01ce6f7e00fc05e0cb7d96554dc85"
    },
    {
      "sourcePath": "public/assets/css/landing.css",
      "destinationPath": "public/assets/css/landing.css",
      "sourceGitObject": "c07befc529471842aca638e3a68cfca5416230ce",
      "sourceSha256": "0a214d30e2b71b30cef80d272979def3f2fa2b0a4d23576eac41ef42189cec93",
      "originalCreatedAt": "2026-06-20T22:46:36+01:00",
      "classification": "reused",
      "purpose": "Exact pinned baseline component",
      "destinationStatus": "present",
      "destinationSha256": "0a214d30e2b71b30cef80d272979def3f2fa2b0a4d23576eac41ef42189cec93"
    },
    {
      "sourcePath": "public/assets/css/tokens.css",
      "destinationPath": "public/assets/css/tokens.css",
      "sourceGitObject": "756c96fc2aaca8a8dd5cc2c5d58169212721129e",
      "sourceSha256": "c3e7f7985c968f7aba8a8c240739ebf47d40ece09798cb4233ce11edb78268e2",
      "originalCreatedAt": "2026-06-20T22:46:36+01:00",
      "classification": "reused",
      "purpose": "Exact pinned baseline component",
      "destinationStatus": "present",
      "destinationSha256": "c3e7f7985c968f7aba8a8c240739ebf47d40ece09798cb4233ce11edb78268e2"
    },
    {
      "sourcePath": "public/assets/fonts/bricolagegrotesque-704ed999.woff2",
      "destinationPath": "public/assets/fonts/bricolagegrotesque-704ed999.woff2",
      "sourceGitObject": "73967db90a38322bf1e6656b5d5c53115156ae45",
      "sourceSha256": "a22c997a894377f36d81c904163e0c05fbbcd32f0ca2e7beedb86b39be1296a1",
      "originalCreatedAt": "2026-06-20T22:46:36+01:00",
      "classification": "reused",
      "purpose": "Exact pinned baseline component",
      "destinationStatus": "present",
      "destinationSha256": "a22c997a894377f36d81c904163e0c05fbbcd32f0ca2e7beedb86b39be1296a1"
    },
    {